{
  "$schema": "https://schemas.luh.tech/follow-up-register.schema.json",
  "$id": "urn:luhtech:schema-registry:file:follow-up-register",
  "schemaVersion": "1.0.0",
  "version": "1.0.0",
  "ventureId": "schema-registry",
  "lastUpdated": "2026-05-19T00:01:09Z",
  "meta": {
    "sourceOfTruth": ".roadmap/follow-up-register.json",
    "totalCount": 7
  },
  "followUps": [
    {
      "id": "FU-CATALOG-STREAM-MIGRATION-1",
      "title": "Migrate downstream consumers of acronyms-catalog from file/name refs to D9 stream URL",
      "priority": "P2",
      "status": "open",
      "opened": "2026-05-18T15:16:14Z",
      "openedDuring": "luhtech-schema T1 substrate (2026-05-18)",
      "scope": "5 downstream consumers identified in T1 substrate Step 7: schema-registry/schemas/patent/glossary.schema.json â€” update $ref to https://schemas.luh.tech/acronyms-catalog.json; LuhTech-business/filings/glossary.md + glossary.yml â€” link to stream URL; LuhTech-business/docs/LUHTECH-PATENT-FOUNDATION-CORRECTIONS-2026-05-06.md â€” update reference; LuhTech-business/.roadmap/follow-up-register.json â€” close stale catalog-absence FU entries.",
      "blockedBy": [],
      "blocks": [],
      "trackingRepo": "luh-tech/schema-registry",
      "coordination": "Ectropy-Business follow-up-register should also note this as a cross-repo concern once D9 stream URL is validated live."
    },
    {
      "id": "FU-RESOLVER-PROPAGATION-1",
      "title": "Resolve cosmetic jsonschema deprecation warning for decision-log DEC validation",
      "priority": "P3",
      "status": "closed",
      "opened": "2026-05-18T15:23:44Z",
      "openedDuring": "luhtech-schema T2 Phase 1 (2026-05-18)",
      "scope": "Step 17 of T2 Phase 1: DEC log validation passes but triggers jsonschema network auto-fetch deprecation warning. Root cause: decision-log.schema.v2 $refs luhtech-enums; the Draft7Validator may not propagate the local registry through to internal sub-validator $ref resolution. Audit referencing.Registry propagation in validate.py; confirm luhtech-enums $id coverage in schema-map; consider explicit pre-resolution walk.",
      "blockedBy": [],
      "blocks": [],
      "coordination": "Likely folds into T3 substrate prep â€” fixing propagation lets T3 instance validations run clean. Cosmetic only; validation passes.",
      "resolution": {
        "closedDate": "2026-05-18",
        "closedDuring": "luhtech-schema T3 Phase 1 (2026-05-18)",
        "summary": "Resolved without code change. Root cause was substrate-ordering during T2 Phase 1: schema-map.json had not yet been generated when DEC log validation ran in Step 17, so the local registry was empty and luhtech-enums $refs fell through to jsonschema network auto-fetch. T2 landed the schema-map; T3 substrate Step 7 reproduced validation under post-T2 registry and observed zero warnings. Lesson: regenerate indices BEFORE running dependent validations."
      }
    },
    {
      "id": "FU-ECTROPY-XAAS-MIGRATION-1",
      "title": "Bundle XaaSâ†’SNx migration into T5 â€” directory renames, URN segments, description strings",
      "priority": "P2",
      "status": "closed",
      "opened": "2026-05-18T17:57:56Z",
      "openedDuring": "luhtech-schema T4 (2026-05-18)",
      "scope": "T4 substrate confirmed XaaS terminology survives in three Ectropy-domain surfaces: (a) directory names caas/, gaas/, paas/, maas/ holding 6 schemas; (b) URN $id segments encoded into those path components; (c) description-string prose in usf/usf-work-packet, maas/material-supplier, schema-index.json. Bundle into T5 (urn-to-url) so directory rename + URN segment update + description polish land in one coherent mutation pass. Pre-T5: resolve SNx naming-form decision (csx/ vs corsx/ vs full noun); scan Ectropy product code for hard-coded caas/gaas/paas/maas imports that break on rename.",
      "blockedBy": [],
      "blocks": [],
      "trackingRepo": "luh-tech/schema-registry",
      "coordination": "SNx naming-form decision needed from Erik before T5 substrate. Also coordinate with Ectropy-Business and BPC on import paths.",
      "resolution": {
        "closedDate": "2026-05-18",
        "closedDuring": "T5.4 (2026-05-18)",
        "summary": "Completed across T5.1 + T5.3 + T5.4. T5.1 (Ectropy-ai/schemas#5) renamed 4 XaaS directories to SNx (caasâ†’corsx, gaasâ†’govsx, paasâ†’paysx, maasâ†’matsx), converted 57 URN $ids to URL form, updated schema-index.json slugs, corrected description prose. T5.3 (Ectropy-Business#143) migrated consumer-side URNâ†’URL. T5.2 struck. T5.4 aligned schema-registry schema-map. Final: 99/99 D2 compliance."
      }
    },
    {
      "id": "FU-V1-TO-V3-DEPRECATE-1",
      "title": "Define deprecation policy + execute migrate v1-to-v3-deprecate for v-suffix families",
      "priority": "P2",
      "status": "open",
      "opened": "2026-05-18T17:57:56Z",
      "openedDuring": "luhtech-schema T4 (2026-05-18)",
      "scope": "T4 substrate Step 4 surfaced 5 multi-variant schema families: luhtech-enums (2 variants), decision-log (2), roadmap (10), roadmap-business (4 incl v3.0.draft), venture-summary (2). Step 5 showed v-suffix variants are not always old: luhtech-enums v2 IS the active one (6 live $refs from graph/brand/workflow-registry). Three policy decisions before execute: (1) deprecation marker form â€” boolean field, status enum, or _archived/ subdir; (2) per-family current-variant confirmation via $ref evidence; (3) $ref migration plan for consumers of variants to be deprecated.",
      "blockedBy": [],
      "blocks": [],
      "trackingRepo": "luh-tech/schema-registry"
    },
    {
      "id": "FU-CATALOG-DAAS-INVESTIGATE-1",
      "title": "Remove unauthorized DaaS parenthetical from ectropy-ai/schemas/schema-index.json",
      "priority": "P3",
      "status": "closed",
      "opened": "2026-05-18T17:57:56Z",
      "openedDuring": "luhtech-schema T4 (2026-05-18)",
      "scope": "schema-index.json carries 'Decision Lifecycle (DaaS)' as a category name. Erik confirmed: DaaS was never approved â€” it is not in the canonical catalog section J. The Decision Lifecycle category itself is real (decision/ subdir, 5 schemas); only the (DaaS) parenthetical is wrong. Recommended fix: drop the parenthetical. Bundle into FU-ECTROPY-XAAS-MIGRATION-1 Ectropy editing pass at T5. Also audit VaaS, CaaS, PaaS, MaaS, RaaS/HaaS category name parentheticals for the same issue.",
      "blockedBy": [],
      "blocks": [
        "FU-ECTROPY-XAAS-MIGRATION-1"
      ],
      "trackingRepo": "luh-tech/schema-registry",
      "coordination": "Bundled into FU-ECTROPY-XAAS-MIGRATION-1 â€” do the schema-index.json cleanup in the same T5 editing pass as XaaS directory renames. No new DSx acronym needed â€” Decision Lifecycle as a category does not need an SNx-style parenthetical.",
      "resolution": {
        "closedDate": "2026-05-18",
        "closedDuring": "T5.1 (2026-05-18)",
        "summary": "Resolved during T5.1 schema-index slug migration. DaaS slug renamed to 'decision' (directory-aligned; decision/ schemas are data primitives, not service exchanges). VaaS slug renamed to 'voxel' by the same logic. DaaS parenthetical stripped from the 'Decision Lifecycle' category display name. No DSx acronym added to catalog because 'Decision Lifecycle' names a schema primitive tier, not a service-exchange interface."
      }
    },
    {
      "id": "FU-VENTURE-TYPE-ENUM-REVIEW-1",
      "title": "Review ventureType enum â€” propose 5-bucket consolidation (Platform/Hardware/Service/Marketplace/Holding)",
      "priority": "P3",
      "status": "open",
      "opened": "2026-05-18T23:44:40Z",
      "openedDuring": "T5.4 (2026-05-18)",
      "scope": "Per D-T5-C (deferred from T5 arc): luhtech-enums.schema.v2.json ventureType enum includes SaaS, API, Platform, Hardware, Marketplace, Holding. Proposed 5-bucket consolidation: Platform | Hardware | Service | Marketplace | Holding â€” absorbs SaaS + API into Service (broader model covering SaaS, managed-services, professional-services). Requires: audit current usage across 8 venture roadmap.json files; draft migration mapping (SaaSâ†’Service, APIâ†’Platform); file DEC with breaking-change semantics; schema change additive then deprecation pass.",
      "blockedBy": [],
      "blocks": []
    },
    {
      "id": "FU-ECTROPY-SCHEMA-HOSTING-WIRE-1",
      "title": "Wire schemas.luh.tech/ectropy/* hosting to actually serve Ectropy schemas",
      "priority": "P2",
      "status": "open",
      "opened": "2026-05-18",
      "openedDuring": "T5.4-postmerge",
      "scope": "T5 arc closed L11 SH-1 by migrating 57 Ectropy schemas from URN to URL $id form at https://schemas.luh.tech/ectropy/<path>. T5.4 verified the schemas are correct and the schema-map indexes them. However: curl https://schemas.luh.tech/ectropy/corsx/takt-wagon.schema.json returns 404. The luh-tech/schema-registry Pages deployment serves only this repo's schemas/ directory; the actual Ectropy schema files live in Ectropy-ai/schemas (separate repo). Every Ectropy $id URL is therefore unresolved at the HTTP layer. Consequence: D2 rationale (URL form resolves automatically in ajv and standard JSON Schema tools) is paper-only for L11 until hosting is wired. Decision options: (A) schema-registry Pages workflow ingests Ectropy-ai/schemas as a build step and serves under /ectropy/<path>; (B) Cloudflare routes schemas.luh.tech/ectropy/* to a separate Pages site backed by Ectropy-ai/schemas; (C) Ectropy gets its own subdomain â€” requires re-migrating all 57 $ids, breaks D-T5-A; (D) git submodule the Ectropy schemas into schema-registry. Substrate before DEC: inventory current consumers that fetch Ectropy schemas via HTTP (if zero, downgrade to P3). Tenth discipline-catch from T5 arc: URL-form migrations must include HTTPS resolve verification as a gate criterion, not just $id field shape and registry indexing.",
      "blockedBy": [],
      "blocks": []
    }
  ],
  "indexes": {
    "byStatus": {